{
  "id": "srcf_bbbbbbbbbbbbbbbbbbbbbbbbbbbbbbbb",
  "corpus_release_id": "corpus-synthetic-1",
  "locale": "en-US",
  "title": "Synthetic launch corpus",
  "author": "Pattern/Like",
  "edition": "internal-1",
  "location": "contracts/m7/fixtures/corpus",
  "exclusions": [
    "Do not derive house claims from this fragment."
  ],
  "normalized_proposition": "A natal square can describe friction that asks for skill rather than fate.",
  "excerpt": "Friction between initiative and effort can be worked with.",
  "license_class": "internal_synthetic",
  "allowed_transformations": [
    "intersection",
    "tension",
    "counterbalance"
  ]
}
